{
  "$schema": "http://json-schema.org/draft-07/schema#",
  "title": "RequirementsPackSchema",
  "type": "array",
  "items": {
    "type": "object",
    "required": ["requirement_id", "name", "authority", "jurisdiction", "domain"],
    "additionalProperties": false,
    "properties": {
      "requirement_id": {"type": "string", "minLength": 1},
      "name": {"type": "string", "minLength": 1},
      "category": {"type": "string"},
      "authority": {"type": "string", "minLength": 1},
      "jurisdiction": {"type": "string", "minLength": 1},
      "domain": {"type": "string", "minLength": 1},
      "description": {"type": "string"},
      "status": {
        "type": "string",
        "enum": [
          "DRAFT",
          "VALIDATION_PENDING",
          "UNDER_REVIEW",
          "PUBLISHED",
          "SUPERSEDED",
          "ARCHIVED",
          "REJECTED"
        ]
      },
      "evidence_refs": {
        "type": "array",
        "items": {"type": "string"}
      },
      "metadata": {"type": "object"}
    }
  }
}
